{"audience":"response_rich_local","bundleId":"pb_89d9518d833b885efecf","bundleSemanticFingerprint":"89d9518d833b885efecf55307e972f904022a386346c3cc53160a1b8b3f08124","capability":"price_revenue","environment":"local","evidence":{"artifactContractSha256":"fd6f6050a967752fe3c9e3864da71ea9358df739a542f7234c87b2252c9acabc","inputAuthorityId":"auth_68e8d92de64aae1f","priceRevenueCapabilityFingerprint":"d91783271a2da4da40e32b26f0f0874736b269949e68991845eaaa0c0301f020","pricingPolicySha256":"9c8240885f594eeb2c268fd4224328af62310b451dad992d6a3ac1b437cabce6","readinessReportFingerprint":"2e78f3b628f6454a52917c536f719ed839172169602492540bc64b3a7b2f12d9","recommendationsFingerprint":"8868af44d4af5787528b99e76821de72491b8638c360814f06f7edf2228df539","responseAssessmentsFingerprint":"45b3c29c645b60edc43099cf56835e158ca5e7dafbdbe414df7fea6fdf171229","responsePolicySha256":"a26e5f22379a025658b0b02033868ecc655d9dd023515a02f4ca65fd2ce98440","sourcePublicationFingerprint":"f9950a36f28c6e9849e87ac7274488ff04ae7b8f48366c36eafd91c0d69a2952"},"predecessorRecordId":"rselrec_8ab5330a11fe3a6c","recordId":"rselrec_42302803ef9bbcc2","recordedAt":"2026-08-12T14:15:23.867543Z","retailerId":"retailer-demo","review":{"actor":"nilay.shah","reason":"Approved verified response-rich local pricing bundle for client demo"},"schemaVersion":"retail-pricing-result-selection/v2","selectionId":"rsel_10cadb8fbae7956c","semanticIdentityExcludes":["/bundleId","/bundleSemanticFingerprint","/predecessorRecordId","/recordId","/recordedAt","/review","/selectionId","/state"],"state":"approved","tenantId":"tenant-demo"}
